sampler_label,aggregate_report_count,average,aggregate_report_median,aggregate_report_90%_line,aggregate_report_min,aggregate_report_max,aggregate_report_error%,aggregate_report_rate,aggregate_report_bandwidth
HTTP Request: Home Page / Product Page,1591,1394,1220,2154,403,7544,0.0,0.055641893946550135,48.843680156373836
HTTP Request: Saved Item Count,4756,8,6,9,4,1047,0.0,0.16515705042981635,0.06495356733325501
HTTP Request: Bread Crumb,4754,12,9,14,6,1015,0.0,0.16516483860852132,0.08739059593699013
HTTP Request: Header Bookmark Tool,3986,12,10,15,7,1013,0.0,0.13847063319605193,0.10983104270419043
HTTP Request: FavIcon Servlet,21445,0,0,0,0,2663,0.0,0.7448101803760422,0.03068839028824484
HTTP Request: Search Assist,359,50,37,103,5,236,0.0,0.012502109077941597,0.021124549965427664
HTTP Request: Perform Basic Keyword Search,359,910,796,1326,290,4225,0.0,0.012501795174209554,0.6354735848581635
HTTP Request: Saved Item List,1637,9,6,9,4,1005,0.0,0.05689840700796511,0.022325665057916635
HTTP Request: Navigation Portlet,925,145,135,256,0,5193,0.001081081081081081,0.03217153179062085,0.03202375060943315
HTTP Request: Add Search To History,924,14,10,16,7,1018,0.0,0.03213631361703252,0.010364173079437907
HTTP Request: Suggested Portals,512,174,77,215,22,8281,0.0,0.017806847456250104,0.09366738411828839
HTTP Request: Reference List,512,54,22,123,10,1105,0.0,0.017806535332339505,0.02885037210529032
HTTP Request: Biographies List,512,45,21,110,10,305,0.0,0.017806326017275057,0.023985904464939724
HTTP Request: Primary Sources List,511,85,69,158,23,476,0.0,0.01779446363743143,0.012844147396992082
HTTP Request: Creative Works List,511,82,63,147,23,1031,0.0,0.017794447526455138,0.008190463881136851
HTTP Request: Magazine List,511,148,126,269,23,1189,0.0,0.01779432793435084,0.03768596694116826
HTTP Request: Critical Essay List,511,106,93,193,23,1072,0.0,0.01779435519873056,0.021709688731719346
HTTP Request: Plot Summary List,511,85,71,152,22,1043,0.0,0.017794502675687284,0.009472713388124152
HTTP Request: News List,511,152,133,252,22,3136,0.0,0.017794335370082476,0.03588364242749696
HTTP Request: Academic Journal List,511,134,113,242,25,3104,0.0,0.017794234988229688,0.03246652819736808
HTTP Request: Website List,511,85,72,154,23,370,0.0,0.017794142043079515,0.009670130569044127
HTTP Request: Audio List,511,120,99,209,25,3354,0.0,0.017794023074704114,0.021596724254851776
HTTP Request: View Full List Page,317,581,481,720,166,5517,0.0,0.01103715213342406,0.3192995940330022
HTTP Request: Sidebar Limiter Ajax Calls,1113,81,55,157,20,1111,0.0,0.03891403480641894,0.04381075985780259
HTTP Request: Go To Advanced Search Page,355,422,334,472,181,3333,0.0,0.012454447856963157,0.4097784347038559
HTTP Request: View Document,64,773,629,1064,303,5766,0.0,0.002251446545610842,0.1533876630654134
HTTP Request: MLA7 Citation - Get Bookmark,711,12,11,18,8,131,0.0,0.02491135010513045,0.0106586228444193
HTTP Request: MLA7 Citation - Get Citation,711,53,38,75,13,5035,0.0,0.024911576167687213,0.028899336249272448
HTTP Request: Bookmark Tool,711,15,10,15,7,1019,0.0,0.024911752481872756,0.01703779867474382
HTTP Request: Translate Form,711,14,11,19,8,178,0.0,0.02491188166414733,0.03612695714846269
HTTP Request: Perform Advanced Search WIth Default Date Range,106,734,597,1163,332,2689,0.0,0.003750753114071619,0.2611465311186363
HTTP Request: Email Form,711,17,12,20,8,1016,0.0,0.02491200910202824,0.03629442781775145
HTTP Request: Related Subjects,711,16,12,19,8,1010,0.0,0.024912118210839,0.028457574314495415
HTTP Request: Clear Document In Session,711,12,10,17,7,275,0.0,0.02491225437997551,0.008032263979777837
HTTP Request: Browse Items,236,419,368,508,184,3650,0.0,0.008280902529952568,0.3059943296563787
HTTP Request: Perform Related Subjects Search,138,938,743,1711,319,4112,0.0,0.004835273615344944,0.5509037609804947
HTTP Request: Topic Page,236,1175,1065,1562,386,5212,0.0,0.008281290161844833,0.36539188173677256
HTTP Request: Display Group Ajax Calls,2867,317,234,557,10,3711,0.0,0.10047126173226262,0.6911025138627211
HTTP Request: Sort By Title,30,473,364,638,195,2963,0.0,0.0010660881929986364,0.02236491311105821
HTTP Request: Sort By Relevance,30,403,349,650,158,1018,0.0,0.0010650730901082721,0.022387302430716908
HTTP Request: Perform Advanced Search WIth New Date Range,71,1009,792,1595,304,3919,0.0,0.0025156849412871023,0.20900956437504895
HTTP Request: View More,414,649,550,766,241,5622,0.0,0.014627006046182474,0.42461901551416575
HTTP Request: Subject Linking Portlet,421,13,10,16,8,205,0.0,0.014872207116079094,0.02220122901658749
HTTP Request: Subject Linking Ajax,421,391,382,658,8,1512,0.0,0.014871604536270342,0.09317468819217208
HTTP Request: Go To Home Page,467,287,207,315,90,3380,0.0,0.01649714700035414,0.2784067770443259
HTTP Request: Sort By Content Level,27,565,377,524,165,3402,0.0,9.662630335462905E-4,0.02067613469565327
HTTP Request: Full List Pagination,10,409,402,508,202,676,0.0,3.8094650349204136E-4,0.008764113294156795
HTTP Request: Follow Spotlight Links,233,906,813,1067,480,3796,0.0,0.0082939318177579,0.5311193842005689
HTTP Request: Portal Page Ajax Calls,2951,364,238,839,28,5830,0.0,0.1049201655669367,0.4725256599090874
HTTP Request: Featured Links,233,686,651,849,343,3505,0.0,0.008294177163695411,0.2061842712601564
HTTP Request: Download Citation Pop Up,11,14,13,16,8,49,0.0,4.082670817926354E-4,7.423762756815304E-4
HTTP Request: Download Citation CSS,11,14,9,10,8,70,0.0,4.0827026392853904E-4,8.173379307163135E-4
HTTP Request: Download Citation JS,11,0,0,0,0,0,0.0,4.082735976479284E-4,0.0
HTTP Request: Download Citation i18n,11,9,9,12,7,13,0.0,4.082765828883119E-4,6.953460552316562E-4
HTTP Request: Download Citation,11,267,15,88,13,2707,0.0,4.0827970455692853E-4,0.0027072453065835403
HTTP Request: Print Document Tool (Audit Logging),11,235,237,293,111,394,0.0,4.082812957170661E-4,0.004566450859226131
HTTP Request: Download,11,15,14,22,11,24,0.0,4.0828829696901246E-4,3.91143378248634E-4
HTTP Request: Save Highlight,1,14,14,14,14,14,0.0,71.42857142857143,48.409598214285715
HTTP Request: Save Note,1,13,13,13,13,13,0.0,76.92307692307693,54.38701923076923
TOTAL,62667,123,9,341,0,8281,1.595736192892591E-5,2.1758880892079744,55.344792101172864
