sampler_label,aggregate_report_count,average,aggregate_report_median,aggregate_report_90%_line,aggregate_report_min,aggregate_report_max,aggregate_report_error%,aggregate_report_rate,aggregate_report_bandwidth
HTTP Request: Home Page / Product Page,5058,694,629,901,288,11229,0.0,0.7009072855418402,583.1783781467643
HTTP Request: Saved Item Count,10831,8,5,8,4,5102,0.0,1.5018050501470608,0.5906491917086523
HTTP Request: Bread Crumb,10668,11,8,12,5,5789,0.0,1.4793178386761465,0.8131166391865722
HTTP Request: Header Bookmark Tool,9263,12,9,14,6,3979,0.0,1.2852956790587688,1.0368290279668713
HTTP Request: FavIcon Servlet,45483,0,0,4,0,1045,0.0,6.309632708709798,0.3890669439711607
HTTP Request: Search Assist,617,45,34,90,5,309,0.0,0.08593065827619478,0.14148566230602233
HTTP Request: Map Page,167,624,531,745,297,3402,0.0,0.023251138470414805,12.012788904967445
HTTP Request: Map Ajax Calls,167,356,318,443,190,5284,0.0,0.023252640636704642,0.0480799960891704
HTTP Request: Perform Basic Keyword Search,617,1058,939,1551,370,4914,0.0,0.08591519877462925,22.579417791156096
HTTP Request: Go To Advanced Search Page,491,269,248,322,113,3057,0.0,0.06841000246192412,1.541889837681943
HTTP Request: Go To Home Page,484,215,208,278,62,1356,0.0,0.06750636777524954,1.1292784677682897
HTTP Request: Saved Item List,3769,7,5,8,4,3161,0.0,0.5250430489329255,0.2059865516575354
HTTP Request: Perform Advanced Search WIth Default Date Range,391,975,923,1304,392,5260,0.0,0.05459722606993807,21.384893760701267
HTTP Request: Perform Advanced Search WIth New Date Range,98,1297,1111,2272,365,4284,0.0,0.013691418889240333,2.1860968696875895
HTTP Request: Navigation Portlet,2361,103,70,248,10,651,0.0,0.3293949178591479,0.35044219999008047
HTTP Request: Add Search To History,2360,15,9,14,6,4391,0.0,0.329403935204571,0.10621254120689694
HTTP Request: Suggested Portals,1129,185,145,334,26,3547,0.0,0.1576595887891604,8.23645329686414
HTTP Request: Reference List,1127,123,112,207,10,1239,0.0,0.1577678329447233,0.5066091724881177
HTTP Request: Biographies List,1127,81,69,167,9,3844,0.0,0.1577319296171299,0.3158767607421462
HTTP Request: Magazine List,1127,259,232,440,53,931,0.0,0.15769235774141446,0.49535490649381886
HTTP Request: News List,1127,262,230,434,46,2574,0.0,0.1576544376996385,0.4775964394979762
HTTP Request: Academic Journal List,1126,252,231,408,34,3245,0.0,0.15764786032231567,0.48787373944714885
HTTP Request: Follow Spotlight Links,243,675,649,817,351,3635,0.0,0.03419714187887541,1.7696429970551053
HTTP Request: Case Overview List,1125,297,293,368,114,3529,0.0,0.15774237431297938,2.429002934244776
HTTP Request: Portal Page Ajax Calls,2911,219,190,374,9,5947,0.0,0.4078362277656753,2.515892432371829
HTTP Request: Statistics List,1125,123,103,220,25,3385,0.0,0.1577399413796314,0.13432021560385934
HTTP Request: Experimental Activity List,1125,117,103,206,27,531,0.0,0.1577250357720381,0.15641339875580884
HTTP Request: Website List,1123,124,106,225,25,2763,0.0,0.15793107201727202,0.14921524768422842
HTTP Request: Audio List,1123,201,186,342,24,729,0.0,0.15792585275741633,0.3764630191495995
HTTP Request: View Full List Page,908,594,559,808,224,5171,0.0,0.1276700151924506,8.412778736606423
HTTP Request: View More,549,585,547,727,185,4500,0.0,0.07775423119689538,6.006549352241043
HTTP Request: MLA7 Citation - Get Bookmark,1411,13,9,16,6,3739,0.0,0.19943539007145328,0.08538115070368467
HTTP Request: MLA7 Citation - Get Citation,1410,30,19,55,11,4206,0.0,0.199582942424426,0.23626700714726334
HTTP Request: Bookmark Tool,1407,13,8,13,6,4137,0.0,0.19957987514271663,0.13650926682020748
HTTP Request: Translate Form,1407,11,10,17,7,141,0.0,0.19963662445257777,0.2896944454248521
HTTP Request: Email Form,1407,15,10,18,7,4409,0.0,0.19960150630333612,0.29149837407053014
HTTP Request: Subject Linking Portlet,664,10,9,15,6,137,0.0,0.09418021582871569,0.14072970612262178
HTTP Request: Subject Linking Ajax,663,404,403,767,7,2144,0.0,0.09412371319894133,0.46367108603290697
HTTP Request: Related Subjects,1405,12,10,17,7,169,0.0,0.1997783526717831,0.22412064620938704
HTTP Request: Clear Document In Session,1405,11,9,15,7,1246,0.0,0.199832254689551,0.06443073470924122
HTTP Request: Sidebar Limiter Ajax Calls,3114,117,99,213,17,3455,0.0,0.44272434992454923,0.47499258860564864
HTTP Request: Full List Pagination,79,551,516,704,211,1761,0.0,0.011312954263444338,0.47703702987693936
HTTP Request: View Document,10673,467,431,599,171,9097,0.0,1.519637177902912,43.45018588654235
HTTP Request: Featured Links,237,655,625,815,266,4744,0.0,0.033821948703663215,0.9761111002939942
HTTP Request: Download Citation Pop Up,495,10,9,13,6,206,0.0,0.07111911604254734,0.109519061108418
HTTP Request: Download Citation CSS,495,7,8,12,0,47,0.0,0.07110113684254071,0.117041381328468
HTTP Request: Download Citation JS,495,0,0,0,0,1,0.0,0.07108326880791492,0.0
HTTP Request: Download Citation i18n,495,9,8,11,6,116,0.0,0.07106533833346183,0.12103848200632811
HTTP Request: Download Citation,495,20,15,26,12,154,0.0,0.07104730473078885,0.4604711388086357
HTTP Request: Download,495,25,13,24,9,4625,0.0,0.07121023447875834,0.08078697702916081
HTTP Request: Print Document Tool (Audit Logging),495,233,212,292,97,3028,0.0,0.07113157401240276,0.8023431892326196
HTTP Request: Browse Items,312,330,314,405,154,4334,0.0,0.04484825764519048,1.2586882886806878
HTTP Request: Topic Page,312,719,677,905,375,4320,0.0,0.04483702388505626,2.6287893157018685
HTTP Request: Display Group Ajax Calls,3735,244,208,395,9,6624,0.0,0.5360127368681185,2.7473632294796095
HTTP Request: Sort By Title,92,452,415,628,196,2287,0.0,0.013292408127787432,0.3934139675613228
HTTP Request: Perform Related Subjects Search,222,614,552,813,209,4661,0.0,0.03206571217730086,2.9779386895909785
HTTP Request: Sort By Content Level,62,485,455,638,196,1725,0.0,0.008964527653254383,0.20326637204698336
HTTP Request: Sort By Relevance,92,457,411,630,207,2318,0.0,0.013372392347154283,0.2919196599295246
HTTP Request: Save Highlight,20,5,6,7,5,10,0.0,0.0031329346465133337,0.0021258980850876854
HTTP Request: Save Note,20,6,6,7,5,15,0.0,0.0031337568919148446,0.002218265315531714
TOTAL,143434,121,8,442,0,11229,0.0,19.875181851526015,737.1178685457865
