sampler_label,aggregate_report_count,average,aggregate_report_median,aggregate_report_90%_line,aggregate_report_min,aggregate_report_max,aggregate_report_error%,aggregate_report_rate,aggregate_report_bandwidth
HTTP Request: Login ITOF,96814,403,315,555,184,7150,0.0,3.3599093344357422,2855.1756473247656
HTTP Request: Login/ Ajax MarkList,96802,7,6,9,3,3911,0.0,3.359790558871217,0.5951668766528535
HTTP Request: Search Assist,118445,31,15,76,6,4266,0.0,4.113375741498097,3.3191261945311568
HTTP Request: Navigate To Advanced Search,28153,134,107,159,43,3109,0.0,0.9778412143278381,13.140003952747184
HTTP Request: Navigate To Advanced Search / Ajax Marklist,28149,7,6,9,3,1125,0.0,0.9777903445765271,0.2722584557662675
HTTP Request: Basic Search,33700,573,493,890,69,10815,0.0,1.1705477270689786,46.708642389845465
HTTP Request: Basic Search/ Ajax MarkList,33694,7,6,9,3,3013,0.0,1.1705911266315978,0.24472937004677084
HTTP Request: Ajax Suggest Also Try,177350,11,7,14,4,5525,0.0,6.16181349588986,3.204922921241774
HTTP Request: Navigate To Subject Guide Search,7803,178,77,729,27,1889,0.0,0.2712489088167054,2.5858329919981746
HTTP Request: Navigate To Subject Guide Search / Ajax Marklist,7803,7,6,9,3,707,0.0,0.27125407611132824,0.08674932854795674
HTTP Request: Advanced Search,28142,599,504,985,31,8579,0.0,0.9777658845176564,26.20783719305536
HTTP Request: Navigate Topic Finder,3901,92,74,101,20,4289,0.0,0.13557919581900313,9.28552646159178
HTTP Request: Ajax Suggest Did You Mean,177333,11,7,13,4,3498,0.0,6.1615647309148125,3.182746427843506
HTTP Request: Topic Finder,3901,3045,2085,6060,660,20675,0.0,0.13556694087724494,105.29284013967226
HTTP Request: Click on Topic,3900,258,207,373,88,15414,0.0,0.13557279191724747,10.586114008062202
HTTP Request: Click on Topic/ Ajax MarkList,3900,7,6,9,3,311,0.0,0.13557322078484868,0.04621608807521241
HTTP Request: Click on Topic/ Scribble,3900,7,6,9,4,325,0.0,0.13557286260952245,0.04758517177159908
HTTP Request: Click on Topic/ doc Linking,3900,156,84,408,7,1740,0.0,0.13557221224337354,2.9665996962569765
HTTP Request: Ajax Limit Expand Search Results (TY),131713,98,75,202,11,5035,0.0,4.57701615992886,6.626928373487445
HTTP Request: Advanced Search/ Ajax MarkList,28136,7,6,9,3,915,0.0,0.9777737187796846,0.2722172634267
HTTP Request: Ajax Limit Expand Search Results (SU),131706,114,93,218,14,4401,0.0,4.5774780544776394,8.209994298353934
HTTP Request: Subject Guide Search,7803,178,111,224,26,3248,0.0,0.2712674855934125,3.0225950466967353
HTTP Request: Ajax Limit Expand Search Results (PU),131685,104,81,207,11,4948,0.0,4.576972328894277,8.08017239576105
HTTP Request: Limit By PU,3344,403,372,659,56,1888,0.0,0.11625208290775939,1.5362597653574772
HTTP Request: Subject Guide Search / Ajax Marklist,7803,7,6,9,3,3010,0.0,0.2712758318265061,0.08677176775611221
HTTP Request: Subject Guide Search Result,5579,208,175,350,52,3417,0.0,0.19404497231354928,3.1462332337092045
HTTP Request: Subject Guide Search Result/ Ajax MarkList,5579,7,6,9,3,2992,0.0,0.1940450937981428,0.062330130654537165
HTTP Request: Limit By PU/ Ajax MarkList,3343,7,6,9,3,688,0.0,0.11623544983727559,0.02877656154312417
HTTP Request- BookMark Login,5749,338,305,440,156,5165,0.0,0.19989887877556878,42.58620864208377
HTTP Request: Retrieve Document,389352,287,187,408,5,300445,2.568370009657071E-6,13.537566946462475,381.21497470531125
HTTP Request: Tab Visit,11155,363,283,643,5,8927,0.0,0.387910881691354,26.288015301723725
HTTP Request: Tab Visit/ Ajax MarkList,11154,7,6,9,4,1017,0.0,0.3880180553282299,0.09547291939928516
HTTP Request: SimilarArticlesBySubject ,435042,262,207,460,7,12807,0.0,15.128225939210434,41.78513979638252
HTTP Request: Click On Next Page Link,5776,394,346,572,133,5732,0.0,0.20090412421106174,3.0610235970237354
HTTP Request: ATP Page,6862,224,159,379,36,9264,0.0,0.23867615221764651,2.4923859626487994
HTTP Request: ATP Page/ Ajax MarkList,6862,7,6,9,4,1233,0.0,0.23867903294435006,0.059628963267168135
HTTP Request: Search Within Results,3321,356,289,629,29,2700,0.0,0.11552627575742849,1.2978668630636547
HTTP Request: Search Within Results/ Ajax MarkList,3321,6,6,9,3,279,0.0,0.11552869108602049,0.028375582418015157
HTTP Request: Ajax Limit Expand Search Results (GS),336,53,32,115,12,211,0.0,0.011727694248400174,0.008012854109176386
HTTP Request: Navigate To Publication Search,6231,135,124,177,35,1728,0.0,0.21678192708800292,2.2809108754258536
HTTP Request: Navigate To Publication Search / Ajax Marklist,6231,7,6,9,4,1016,0.0,0.2167823419005789,0.08795757581354435
HTTP Request: Publication View All,3060,252,261,296,113,3218,0.0,0.10645982195882037,1.34958321680955
HTTP Request: Publication Search/ Ajax Browse Index (PTA),6229,14,11,16,6,2620,0.0,0.216731286502512,0.16058023028021035
HTTP Request: Publication Search/ Ajax Browse Index (PF),6228,13,11,16,6,1317,0.0,0.21669349936202761,0.16218381065660914
HTTP Request: Publication Search/ Ajax Browse Index (PCD),6225,14,11,16,6,1073,0.0,0.21660331759036064,0.1618942276655535
HTTP Request: Publication Search/ Ajax Browse Index (PLG),6223,14,11,16,5,3109,0.0,0.2165550055281903,0.15769774317051352
HTTP Request: Publication Search/ Ajax Browse Index (PUB_SU),6221,13,11,16,5,841,0.0,0.21649223283219377,0.1595185463825474
HTTP Request: ATP Publication,4478,135,109,175,29,7821,0.0,0.15583543680432815,1.5230519120752315
HTTP Request: ATP Publication/ Ajax MarkList,4477,7,6,9,4,486,0.0,0.15581497881375694,0.06301185711051233
HTTP Request: Limit By TY,3377,377,321,628,62,6135,0.0,0.1175894858773182,1.4991501593251353
HTTP Request: Limit By TY/ Ajax MarkList,3376,7,6,9,4,791,0.0,0.11764149979531216,0.028843882483895033
HTTP Request: Limit By SU,3364,415,388,646,61,2573,0.0,0.11720023957066808,1.6004068980493442
HTTP Request: Limit By SU/ Ajax MarkList,3364,7,6,9,3,1032,0.0,0.11720031715158356,0.0291759973389013
HTTP Request: Retrieve Document/ Ajax MarkList,45758,7,6,9,3,4376,0.0,1.5940944579873302,0.395312168281652
HTTP Request: DocLinking/getTerms,45747,142,72,372,6,4498,0.0,1.593830902021469,26.506904404831392
HTTP Request: Retrieve Document/ Scribble,45741,7,6,9,4,1028,0.0,1.5938407589972765,0.5590787620731931
HTTP Request: Popular Searches,1558,548,477,916,182,3619,0.0,0.0542925263898094,0.9378248229856296
HTTP Request: Save This Document,45728,127,110,224,27,4561,0.0,1.5935444166354773,0.7012433059081336
HTTP Request: Popular Searches/ Ajax MarkList,1557,7,6,9,3,414,0.0,0.054261651565757074,0.019729155172658344
HTTP Request: Related Document,39998,434,414,641,52,9211,0.0,1.393977111354473,18.94500073177656
HTTP Request: Related Document / Ajax Marklist,39996,84,67,161,3,5275,0.0,1.393944961827879,3.228442197051438
HTTP Request: Document Download,45696,10,8,12,5,4901,3.2825630252100843E-4,1.59301977333702,2.653339359169745
HTTP Request: Print Document,45674,15,10,22,6,3019,0.0,1.5923449742836322,0.25095470040414897
HTTP Request: Navigate Citation,45672,21,15,29,10,4849,0.0,1.5923444741198,6.935948770913467
HTTP Request: Citation Tools/ Popup Window,45668,10,8,13,5,3014,0.0,1.5922099000395646,2.426951755953738
HTTP Request: Header Quick Search,45612,125,113,210,28,4208,0.0,1.5905361772356374,11.377384677496577
HTTP Request: Publication Search,3170,98,74,141,19,1157,0.0,0.11058644374858322,1.079839687016555
HTTP Request: Limit By GS,17,285,266,416,143,623,0.0,0.001241013239129235,0.012945946701109406
HTTP Request: Limit By GS/ Ajax MarkList,17,6,6,8,4,12,0.0,0.0012410101589091609,3.275759237240116E-4
TOTAL,2759904,157,80,354,3,300445,5.797303094600392E-6,95.78101532726545,3696.579177935625
